{
  "@context": ["https://schema.org", "https://verveliolabs.com/openom/ns/0.1"],
  "@type": "RealEstateListing",
  "specVersion": "0.1",
  "assertedBy": { "broker": "Dana Sample", "brokerage": "Placeholder Retail Advisors", "license": "TX 000000" },
  "assertedDate": "2026-08-17",
  "property": {
    "address": { "streetAddress": "500 Example Blvd", "addressLocality": "Testville", "addressRegion": "TX", "postalCode": "75000", "addressCountry": "US" },
    "apn": "R000000", "buildingSF": 6000, "yearBuilt": 2021
  },
  "deal": { "askingPrice": 2500000, "capRate": 0.0575, "noi": 143750, "noiType": "in-place", "noiAsOfDate": "2026-05-31", "pricePerSF": 416.67, "status": "active" },
  "lease": {
    "tenantEntity": "Placeholder Quick Service, LLC",
    "guarantor": { "name": "Placeholder Brands Inc.", "type": "corporate" },
    "landlordResponsibilities": { "roof": false, "structure": false, "parking": false, "hvac": false, "taxes": false, "insurance": false, "cam": false },
    "leaseTypeAsserted": "NNN",
    "commencement": "2021-06-01", "expiration": "2031-05-31",
    "rentSchedule": [
      { "periodStart": "2021-06-01", "periodEnd": "2026-05-31", "annualRent": 143750, "rentPSF": 23.96, "source": "asserted" },
      { "periodStart": "2026-06-01", "periodEnd": "2031-05-31", "annualRent": 158125, "rentPSF": 26.35, "escalationFromPrior": 0.10, "source": "asserted" }
    ]
  },
  "meta": { "supersedes": null }
}
