{"@context":["https://schema.org","https://verveliolabs.com/openom/ns/0.1"],"@type":"RealEstateListing","assertedBy":{"broker":"Jane Example","brokerage":"Example Net Lease Advisors","license":"MI 6501-000000"},"assertedDate":"2027-01-01","deal":{"askingPrice":1750000,"capRate":0.0661,"noi":115625,"noiAsOfDate":"2026-06-30","noiType":"in-place","status":"active"},"lease":{"commencement":"2019-05-01","expiration":"2034-04-30","guarantor":{"name":"Example Retail Corp.","type":"corporate"},"landlordResponsibilities":{"cam":false,"hvac":false,"insurance":false,"parking":false,"roof":false,"structure":false,"taxes":false},"leaseTypeAsserted":"NNN","options":[{"count":4,"escalation":"10% per option","lengthYears":5}],"rentSchedule":[{"annualRent":115625,"periodEnd":"2029-04-30","periodStart":"2024-05-01","rentPSF":12.7,"source":"asserted"},{"annualRent":127188,"escalationFromPrior":0.1,"periodEnd":"2034-04-30","periodStart":"2029-05-01","rentPSF":13.98,"source":"asserted"}],"tenantEntity":"Example Retail Stores, LLC"},"meta":{"sourceDocHash":"sha256:0000000000000000000000000000000000000000000000000000000000000000","supersedes":"sha256:757669867ac6b7b4974790371cb1e961cb8361bb896321cbe1ed2c78bf0ce7c1"},"property":{"address":{"addressCountry":"US","addressLocality":"Sampleville","addressRegion":"MI","postalCode":"48000","streetAddress":"1000 Example Rd"},"apn":"00-000-000-000","buildingSF":9100,"geo":{"latitude":42,"longitude":-83},"lotAcres":1.25,"yearBuilt":2019},"specVersion":"0.1"}